src_user,src_comment,dst_user,dst_comment,comment_id,parent_id,submission_id,subreddit
Rebal771,"Half of me wants to be facetious and set up my own AI art show. All the vendors can pay $50 per table.

Then, when the door is open, we announce that entry is free and so is all the art.",adamkopacz,"They can generate their own comic-con, right? It will cost them nothing and they can have all the fun. I'm sure people love paying for stuff that no one took any effort to create.",o1be9mo,o12lzv7,1qjyadw,technology
Accomplished-Fix6598,It could really be its own thing. Prompt pros and things like that. I don't know know exactly what it takes to create these AI pieces.,adamkopacz,"They can generate their own comic-con, right? It will cost them nothing and they can have all the fun. I'm sure people love paying for stuff that no one took any effort to create.",o13bmnp,o12lzv7,1qjyadw,technology
RedofPaw,It can be it's own thing. Somewhere else.,Accomplished-Fix6598,It could really be its own thing. Prompt pros and things like that. I don't know know exactly what it takes to create these AI pieces.,o13facv,o13bmnp,1qjyadw,technology
ChainGang315,"It takes about 30 seconds and 3 sentences, it’s a joke that it’s ever considered art",Accomplished-Fix6598,It could really be its own thing. Prompt pros and things like that. I don't know know exactly what it takes to create these AI pieces.,o13ld9v,o13bmnp,1qjyadw,technology
OhK4Foo7,Have you made any?,ChainGang315,"It takes about 30 seconds and 3 sentences, it’s a joke that it’s ever considered art",o14ap5u,o13ld9v,1qjyadw,technology
a_latvian_potato,And have you ever drawn?,OhK4Foo7,Have you made any?,o15kboa,o14ap5u,1qjyadw,technology
OhK4Foo7,Who has not drawn?,a_latvian_potato,And have you ever drawn?,o15o1f3,o15kboa,1qjyadw,technology
ChainGang315,"Yes, as a novelty when ChatGPT was newish. It took me 30 seconds and 3 sentences",OhK4Foo7,Have you made any?,o14jf0t,o14ap5u,1qjyadw,technology
OhK4Foo7,Your experience is not everyone's.,ChainGang315,"Yes, as a novelty when ChatGPT was newish. It took me 30 seconds and 3 sentences",o14ozlm,o14jf0t,1qjyadw,technology
EGO_Prime,"I use AI in my drawings and videos, it's WAY more than just a prompt. My work flows have almost a hundred nodes, with different functions. I do color quantization at different steps, specific dithering in some of my works, vision systems for masking and redraws, and then there's hand touches at the end.

Figuring out all the different processes and sub processes I need to make a drawing mine, is hard. Then you've got figuring out the right loras and checkpoints, sometimes even having to train your own if you can't find one you need.

There are people who just put 1-2 sentences into a prompt. Most serious AI artists do way more than that.

There's also things you can do with AI that are just VERY difficult to do by hand, such as creating artistic QR codes. Like these: https://huggingface.co/monster-labs/control_v1p_sd15_qrcode_monster

Generating an image that a machine reads as a QR code is just, hard. AI makes it actually doable.

If you want to get seriously into it, look up comfyui and try it. It's basically a simplified engine for working with the various python tools and engines. It's a lot fun.

EDIT: This stuff is cool and it's way more complicated than a few prompts. Your downvotes and disagreements don't change that. I've said nothing disrespectful or wrong. You all want to stick your head in the ground go a head. 

Everyone that actually cares about technology and what this subreddit is about, go look up what you can actually do with it on your own hardware and the open models out there. It's pretty cool how far this has all in just a few years. It's only going further in the next few.

Last edit: The amount of disinformation is kind of disturbing. Learning off web accessible data is legal, as the world's various courts repeatedly say. Getty has lost almost every court case regarding web scrapping, but even prior to AI like ""HiQ Labs v. LinkedIn"", and even older cases like ""Feist Publications v. Rural Telephone Service"" show the same thing, collecting publicly available data and transforming it is legal. 

Copyright only exists because our laws make it exist, and those laws have exceptions. Teaching AIs falls under that based off all current court and legal theory. Again, you don't have to like AI, but trying to argue training off publicly available data is some how wrong is naive. It flows in the face of decades of president regarding information access and fair use. If most of your arguments would put cross hairs on things like libraries and even search engines. 

Nothing is stolen. The court and law agrees.",Accomplished-Fix6598,It could really be its own thing. Prompt pros and things like that. I don't know know exactly what it takes to create these AI pieces.,o14s9uh,o13bmnp,1qjyadw,technology
Hereibe,"Lol. Lmao, even.",EGO_Prime,"I use AI in my drawings and videos, it's WAY more than just a prompt. My work flows have almost a hundred nodes, with different functions. I do color quantization at different steps, specific dithering in some of my works, vision systems for masking and redraws, and then there's hand touches at the end.

Figuring out all the different processes and sub processes I need to make a drawing mine, is hard. Then you've got figuring out the right loras and checkpoints, sometimes even having to train your own if you can't find one you need.

There are people who just put 1-2 sentences into a prompt. Most serious AI artists do way more than that.

There's also things you can do with AI that are just VERY difficult to do by hand, such as creating artistic QR codes. Like these: https://huggingface.co/monster-labs/control_v1p_sd15_qrcode_monster

Generating an image that a machine reads as a QR code is just, hard. AI makes it actually doable.

If you want to get seriously into it, look up comfyui and try it. It's basically a simplified engine for working with the various python tools and engines. It's a lot fun.

EDIT: This stuff is cool and it's way more complicated than a few prompts. Your downvotes and disagreements don't change that. I've said nothing disrespectful or wrong. You all want to stick your head in the ground go a head. 

Everyone that actually cares about technology and what this subreddit is about, go look up what you can actually do with it on your own hardware and the open models out there. It's pretty cool how far this has all in just a few years. It's only going further in the next few.

Last edit: The amount of disinformation is kind of disturbing. Learning off web accessible data is legal, as the world's various courts repeatedly say. Getty has lost almost every court case regarding web scrapping, but even prior to AI like ""HiQ Labs v. LinkedIn"", and even older cases like ""Feist Publications v. Rural Telephone Service"" show the same thing, collecting publicly available data and transforming it is legal. 

Copyright only exists because our laws make it exist, and those laws have exceptions. Teaching AIs falls under that based off all current court and legal theory. Again, you don't have to like AI, but trying to argue training off publicly available data is some how wrong is naive. It flows in the face of decades of president regarding information access and fair use. If most of your arguments would put cross hairs on things like libraries and even search engines. 

Nothing is stolen. The court and law agrees.",o15yms2,o14s9uh,1qjyadw,technology
tyrenanig,Dude probably still scraped the internet for his data,Hereibe,"Lol. Lmao, even.",o173zi4,o15yms2,1qjyadw,technology
theoxygenthief,"Ethical ways will develop over time to use ai in art, and there are people pushing this frontier forward. But 99.9% of ai “artists” are just people mashing a prompt and then claiming the output they got (which is made possible by stolen IP) from the ai is art.",EGO_Prime,"I use AI in my drawings and videos, it's WAY more than just a prompt. My work flows have almost a hundred nodes, with different functions. I do color quantization at different steps, specific dithering in some of my works, vision systems for masking and redraws, and then there's hand touches at the end.

Figuring out all the different processes and sub processes I need to make a drawing mine, is hard. Then you've got figuring out the right loras and checkpoints, sometimes even having to train your own if you can't find one you need.

There are people who just put 1-2 sentences into a prompt. Most serious AI artists do way more than that.

There's also things you can do with AI that are just VERY difficult to do by hand, such as creating artistic QR codes. Like these: https://huggingface.co/monster-labs/control_v1p_sd15_qrcode_monster

Generating an image that a machine reads as a QR code is just, hard. AI makes it actually doable.

If you want to get seriously into it, look up comfyui and try it. It's basically a simplified engine for working with the various python tools and engines. It's a lot fun.

EDIT: This stuff is cool and it's way more complicated than a few prompts. Your downvotes and disagreements don't change that. I've said nothing disrespectful or wrong. You all want to stick your head in the ground go a head. 

Everyone that actually cares about technology and what this subreddit is about, go look up what you can actually do with it on your own hardware and the open models out there. It's pretty cool how far this has all in just a few years. It's only going further in the next few.

Last edit: The amount of disinformation is kind of disturbing. Learning off web accessible data is legal, as the world's various courts repeatedly say. Getty has lost almost every court case regarding web scrapping, but even prior to AI like ""HiQ Labs v. LinkedIn"", and even older cases like ""Feist Publications v. Rural Telephone Service"" show the same thing, collecting publicly available data and transforming it is legal. 

Copyright only exists because our laws make it exist, and those laws have exceptions. Teaching AIs falls under that based off all current court and legal theory. Again, you don't have to like AI, but trying to argue training off publicly available data is some how wrong is naive. It flows in the face of decades of president regarding information access and fair use. If most of your arguments would put cross hairs on things like libraries and even search engines. 

Nothing is stolen. The court and law agrees.",o177kn8,o14s9uh,1qjyadw,technology
Chubuwee,"That would be a cool test. AI art show. See how many people support it, just don’t surprise if it actually does well since the general public doesn’t care much it seems. 

If you can only get your AI art accepted under the guise of human made art or withholding it is AI then that should show it",adamkopacz,"They can generate their own comic-con, right? It will cost them nothing and they can have all the fun. I'm sure people love paying for stuff that no one took any effort to create.",o13wte0,o12lzv7,1qjyadw,technology
tyrenanig,Oh do it. See how many are just AI bros coming there to circle jerk about it.,Chubuwee,"That would be a cool test. AI art show. See how many people support it, just don’t surprise if it actually does well since the general public doesn’t care much it seems. 

If you can only get your AI art accepted under the guise of human made art or withholding it is AI then that should show it",o1743dk,o13wte0,1qjyadw,technology
Paranitis,Bet they will still allow those shitty 3D printed dragons and snakes that are at every flea market now.,MetaKnowing,Comic-Con Bans AI Art After Artist Pushback,o137cra,1qjyadw,1qjyadw,technology
Novaskittles,I've seen them being sold at local gas stations.,Paranitis,Bet they will still allow those shitty 3D printed dragons and snakes that are at every flea market now.,o13zg1h,o137cra,1qjyadw,technology
Saint_of_Grey,I've starting printing them and giving them to the folks in my life who are impossible to gift for since they buy everything they want the instant they want it.,Novaskittles,I've seen them being sold at local gas stations.,o148kn7,o13zg1h,1qjyadw,technology
BavarianBarbarian_,"A human created those, so obviously they're art.",Paranitis,Bet they will still allow those shitty 3D printed dragons and snakes that are at every flea market now.,o149y8t,o137cra,1qjyadw,technology
prettymuthafucka,AI art isn’t real. It can never be Art,MetaKnowing,Comic-Con Bans AI Art After Artist Pushback,o12ofbu,1qjyadw,1qjyadw,technology
lurklurklurkPOST,"Normalize the term ""AI Imagery"" in place of ""AI Art""",prettymuthafucka,AI art isn’t real. It can never be Art,o12tetz,o12ofbu,1qjyadw,technology
jessek,I prefer AI slop,lurklurklurkPOST,"Normalize the term ""AI Imagery"" in place of ""AI Art""",o138139,o12tetz,1qjyadw,technology
VFenix,I prefer Clanker slop,jessek,I prefer AI slop,o15rfzw,o138139,1qjyadw,technology
Beginning_Book_2382,"If it ain't broke, don't fix it",jessek,I prefer AI slop,o172564,o138139,1qjyadw,technology
Charliefoxkit,Especially if it's by Microslop.  ,jessek,I prefer AI slop,o19vic7,o138139,1qjyadw,technology
Corevus,Agree. I've always referred to them as graphics or images.,lurklurklurkPOST,"Normalize the term ""AI Imagery"" in place of ""AI Art""",o18thpr,o12tetz,1qjyadw,technology
waiting4singularity,Algorithmic Inference remixed imagery using stolen assets,lurklurklurkPOST,"Normalize the term ""AI Imagery"" in place of ""AI Art""",o12xqel,o12tetz,1qjyadw,technology
No-Manufacturer4916,Stolen Hackjob Inauthentic Trash.,waiting4singularity,Algorithmic Inference remixed imagery using stolen assets,o14rkwc,o12xqel,1qjyadw,technology
Snuffalapapuss,"I like this. And I think its pretty normal to think of it that way.

Granted I use AI generators for fun just because it is quick and dirty. But I also dont pass it off as art. 

And I really do enjoy some AI images. But I also do really enjoy natural art made by a talented artist. 

Because in the end. Right now at least AI does not really surpass humans in the art realm. They mimic the best artist, or what ever they are trained on.

Now this is the hard hitting truth, it soon will surpass humans in this. And this is the frightening part.

But also kinda on the other hand, people also mimic other artist. And you cant really stop that. They make it their own style eventually. But people have to start somewhere. So same same.

I also will admit, I dont know a whole lot about the art side of the world. I just see something I like looking at, and I enjoy it.",lurklurklurkPOST,"Normalize the term ""AI Imagery"" in place of ""AI Art""",o12yl7x,o12tetz,1qjyadw,technology
MizarTheEdgelord,So machines cannot make art? Why not? The ends always justify the means ,prettymuthafucka,AI art isn’t real. It can never be Art,o4z3w07,o12ofbu,1qjyadw,technology
Norci,"Gatekeeping art is pretty tiresome, anything can be art. Art is an expression of human ideas where the medium and tools shouldn't matter, and AI is just a tool. It can be used for creating art, but that would require more effort and specific intentions than just typing a single prompt.

If I have an idea of an anti-violence piece, say a [knotted gun](https://en.wikipedia.org/wiki/Non-Violence_\(sculpture\)), I don't see what it matters if I paint the image of it myself or AI does it, as the concept and idea itself are human in origin. If however I just type a ""anti-violence image"" as a prompt without specifics, the concept outcome itself is randomly generated by AI, thus being non-human in origin.",prettymuthafucka,AI art isn’t real. It can never be Art,o17m29f,o12ofbu,1qjyadw,technology
Sgt-Colbert,">the medium and tools shouldn't matter,

Yes they should.   
There are so many different forms of art. Poetry, photography, drawing, painting, music, the list goes on. But they all have one thing in common, they are made by humans (and sometimes elephants).     
When a computer generates music or a photo or a painting, it is created by a computer not a human.     
If prompting is art then ordering a subway sandwich is cooking.",Norci,"Gatekeeping art is pretty tiresome, anything can be art. Art is an expression of human ideas where the medium and tools shouldn't matter, and AI is just a tool. It can be used for creating art, but that would require more effort and specific intentions than just typing a single prompt.

If I have an idea of an anti-violence piece, say a [knotted gun](https://en.wikipedia.org/wiki/Non-Violence_\(sculpture\)), I don't see what it matters if I paint the image of it myself or AI does it, as the concept and idea itself are human in origin. If however I just type a ""anti-violence image"" as a prompt without specifics, the concept outcome itself is randomly generated by AI, thus being non-human in origin.",o17tp54,o17m29f,1qjyadw,technology
Norci,"> Poetry, photography, drawing, painting, music, the list goes on. 

Those are all skills that can create art, but aren't automatically an art themselves or automatically result in art. Illustrations on your toilet paper aren't art, they're just filler visuals with no meaning to them, and art should have meaning. 

> If prompting is art then ordering a subway sandwich is cooking.

No, as cooking is specifically the process of making food. Art is the result, while painting is the process of creating said art. Painting your walls in a solid color isn't art, is it?

Art is all about conveying or expressing a message. Like I said, prompting itself is not art, it's the result that *might* be art, given the intention behind it and necessary details to convey it. Gating art to certain tools is moot, as it's the end result that is art, not the process.",Sgt-Colbert,">the medium and tools shouldn't matter,

Yes they should.   
There are so many different forms of art. Poetry, photography, drawing, painting, music, the list goes on. But they all have one thing in common, they are made by humans (and sometimes elephants).     
When a computer generates music or a photo or a painting, it is created by a computer not a human.     
If prompting is art then ordering a subway sandwich is cooking.",o17v9sd,o17tp54,1qjyadw,technology
Webecomemonsters,"fuck ooooff

toilet paper gfx are absolutely art

a spork is art

so is a trash can or urinal design",Norci,"> Poetry, photography, drawing, painting, music, the list goes on. 

Those are all skills that can create art, but aren't automatically an art themselves or automatically result in art. Illustrations on your toilet paper aren't art, they're just filler visuals with no meaning to them, and art should have meaning. 

> If prompting is art then ordering a subway sandwich is cooking.

No, as cooking is specifically the process of making food. Art is the result, while painting is the process of creating said art. Painting your walls in a solid color isn't art, is it?

Art is all about conveying or expressing a message. Like I said, prompting itself is not art, it's the result that *might* be art, given the intention behind it and necessary details to convey it. Gating art to certain tools is moot, as it's the end result that is art, not the process.",o1cdq8y,o17v9sd,1qjyadw,technology
Sgt-Colbert,"„Art should have meaning“. 

Exactly. And having a computer generate an image or music has ZERO meaning. Because it lacks any form of human emotion or experience.   

At the end of the day this is a debate that will be going on for years to come.   
You think AI can be art, I think otherwise.   
Something generated by a computer can never be art.",Norci,"> Poetry, photography, drawing, painting, music, the list goes on. 

Those are all skills that can create art, but aren't automatically an art themselves or automatically result in art. Illustrations on your toilet paper aren't art, they're just filler visuals with no meaning to them, and art should have meaning. 

> If prompting is art then ordering a subway sandwich is cooking.

No, as cooking is specifically the process of making food. Art is the result, while painting is the process of creating said art. Painting your walls in a solid color isn't art, is it?

Art is all about conveying or expressing a message. Like I said, prompting itself is not art, it's the result that *might* be art, given the intention behind it and necessary details to convey it. Gating art to certain tools is moot, as it's the end result that is art, not the process.",o17z3xd,o17v9sd,1qjyadw,technology
Norci,"> And having a computer generate an image or music has ZERO meaning. Because it lacks any form of human emotion or experience. 

That all depends on the input and level of fidelity tho. Take Suno, AI music studio, it can both generate full songs and fine-tune details.

If you just ask it to generate you a random pop song, then it's indeed not art. If you provide the lyrics, style, instruments you want etc and refine it, then it has human-created meaning, which makes no sense to be considered lost just because it's processed through AI. Is a thoughtful game not art because it was coded with AI, despite the meaning behind it being human? 

If we agree that art should have meaning, why would the meaning behind the knotted gun be lost because a computer drew it prompted by a human, when the meaning originates from a human? I'm honestly curious here. The piece itself may not be visual art as it was executed by a computer, but it still has an artistic meaning behind it, a human thought.

> At the end of the day this is a debate that will be going on for years to come.

That's frankly because people lack nuance and think about AI in black and white. I get that people are annoyed by prompt ""artists"", but you have AI in photoshop with stuff like generative fill, yet you wouldn't argue that a produced piece is not art just because artist used it in the process on some background that's irrelevant to the final piece. Extrapolate that thinking onto the rest. So where does one draw the line? In amount of fidelity applied and the existence of meaning behind it, imo.",Sgt-Colbert,"„Art should have meaning“. 

Exactly. And having a computer generate an image or music has ZERO meaning. Because it lacks any form of human emotion or experience.   

At the end of the day this is a debate that will be going on for years to come.   
You think AI can be art, I think otherwise.   
Something generated by a computer can never be art.",o180264,o17z3xd,1qjyadw,technology
Sgt-Colbert,"Like I said, this is ultimately a difference in opinion. 
You will never convince me AI is art and I will never convince you that it isn’t.",Norci,"> And having a computer generate an image or music has ZERO meaning. Because it lacks any form of human emotion or experience. 

That all depends on the input and level of fidelity tho. Take Suno, AI music studio, it can both generate full songs and fine-tune details.

If you just ask it to generate you a random pop song, then it's indeed not art. If you provide the lyrics, style, instruments you want etc and refine it, then it has human-created meaning, which makes no sense to be considered lost just because it's processed through AI. Is a thoughtful game not art because it was coded with AI, despite the meaning behind it being human? 

If we agree that art should have meaning, why would the meaning behind the knotted gun be lost because a computer drew it prompted by a human, when the meaning originates from a human? I'm honestly curious here. The piece itself may not be visual art as it was executed by a computer, but it still has an artistic meaning behind it, a human thought.

> At the end of the day this is a debate that will be going on for years to come.

That's frankly because people lack nuance and think about AI in black and white. I get that people are annoyed by prompt ""artists"", but you have AI in photoshop with stuff like generative fill, yet you wouldn't argue that a produced piece is not art just because artist used it in the process on some background that's irrelevant to the final piece. Extrapolate that thinking onto the rest. So where does one draw the line? In amount of fidelity applied and the existence of meaning behind it, imo.",o1837dx,o180264,1qjyadw,technology
Norci,"> and I will never convince you that it isn’t

Well you could, if you provide any actual arguments. Still, I am curious to hear your stance on why the human meaning behind knotted gun would be lost if AI draws it. Or poetry that was illustrated with AI. Or a song composed in Suno.

But I guess just blindly hating on something is easier than having nuance.",Sgt-Colbert,"Like I said, this is ultimately a difference in opinion. 
You will never convince me AI is art and I will never convince you that it isn’t.",o185kye,o1837dx,1qjyadw,technology
05032-MendicantBias,"A banana taped to a wall is art. 

A aim and click photo is art.

Of course artists that use AI assist make art as well.

>“To fix fleeting images is not only impossible … it is a sacrilege … God has created man in his image and no human machine can capture the image of God. He would have to betray all his Eternal Principles to allow a Frenchman in Paris to unleash such a diabolical invention upon the world” -Leipziger Anzeiger 1839",prettymuthafucka,AI art isn’t real. It can never be Art,o17oaw6,o12ofbu,1qjyadw,technology
frogandbanjo,"And the woman danced artlessly to music that was not art; joyless, from his armchair: ""Your joy is not joy!""",prettymuthafucka,AI art isn’t real. It can never be Art,o12wmjn,o12ofbu,1qjyadw,technology
Teledildonic,Sounds like an NPC,frogandbanjo,"And the woman danced artlessly to music that was not art; joyless, from his armchair: ""Your joy is not joy!""",o132h2v,o12wmjn,1qjyadw,technology
