src_user,src_comment,dst_user,dst_comment,comment_id,parent_id,submission_id,subreddit
AutoModerator,"This is an automated reminder from the Mod team. If your post contains images which reveal the personal information of private figures, be sure to censor that information and repost. Private info includes names, recognizable profile pictures, social media usernames and URLs. Failure to do this will result in your post being removed by the Mod team and possible further action.


*I am a bot, and this action was performed automatically. Please [contact the moderators of this subreddit](/message/compose/?to=/r/DefendingAIArt) if you have any questions or concerns.*",Kasm001,"""AI art is now banned in many places on Reddit — is this an art massacre or necessary protection?""",oa0xdog,1rroxgz,1rroxgz,DefendingAIArt
After_Broccoli_1069,It's insecurity and ego,Kasm001,"""AI art is now banned in many places on Reddit — is this an art massacre or necessary protection?""",oa0y2mj,1rroxgz,1rroxgz,DefendingAIArt
BrekLasnar,They're sad nobody wants to pay twenty dollars for them to draw a rough sketch of their OCs anymore.,After_Broccoli_1069,It's insecurity and ego,oa1q3kx,oa0y2mj,1rroxgz,DefendingAIArt
_MoOnThePage_,"a real artist will not look at it as a threat as much as an inspiration, now we have the tool to say what is going in our mind and some people treating it as a threat, those are not real artists, cause the real artist will look at and make something physical of it, ego is what driving these type of actions. ",After_Broccoli_1069,It's insecurity and ego,oa2qwc0,oa0y2mj,1rroxgz,DefendingAIArt
Matyaslike,"I wouldn't call it massacre it just shows how closed minded people on these platforms actually are.
",Kasm001,"""AI art is now banned in many places on Reddit — is this an art massacre or necessary protection?""",oa0yr36,1rroxgz,1rroxgz,DefendingAIArt
Bossanova12345,"Reddit has always been awful. 

But lately it’s something else. ",Matyaslike,"I wouldn't call it massacre it just shows how closed minded people on these platforms actually are.
",oa1bbac,oa0yr36,1rroxgz,DefendingAIArt
Mtf-alpha-4-last-hip,Thats also 90 percent of the internet,Bossanova12345,"Reddit has always been awful. 

But lately it’s something else. ",oa1ffks,oa1bbac,1rroxgz,DefendingAIArt
SufficientWarpSpider,"Nearly 90% of elite society at this point, hope steam stays top dog ",Mtf-alpha-4-last-hip,Thats also 90 percent of the internet,oa1j9xy,oa1ffks,1rroxgz,DefendingAIArt
rampant_cat,Its censorship and people have no right to block it,Kasm001,"""AI art is now banned in many places on Reddit — is this an art massacre or necessary protection?""",oa0xx5r,1rroxgz,1rroxgz,DefendingAIArt
Nervous-Ad2295,"That's right, because censorship is still censorship.",rampant_cat,Its censorship and people have no right to block it,oa1thwj,oa0xx5r,1rroxgz,DefendingAIArt
Kinks4Kelly,"My favorite are the subs that ban any AI related content, but allow news articles written by AI to be posted. ",Kasm001,"""AI art is now banned in many places on Reddit — is this an art massacre or necessary protection?""",oa13pcd,1rroxgz,1rroxgz,DefendingAIArt
carnyzzle,Funny thing is that banning AI makes it easier for reddit to hand over training material to OpenAI,Kasm001,"""AI art is now banned in many places on Reddit — is this an art massacre or necessary protection?""",oa1oxbm,1rroxgz,1rroxgz,DefendingAIArt
ChickenFriedPenguin,"why ban AI art? digital art should be banned.  
it's not real if you can just undo every action you make without problems......only traditional art is real  
show me happy little accidents in digital art, oh right?

at least ai doesn't pretend to be perfect and adds a toe or finger here and there, lol.

conclusion: AI and traditional are both ok because they have happy little accidents.",Kasm001,"""AI art is now banned in many places on Reddit — is this an art massacre or necessary protection?""",oa1gfbd,1rroxgz,1rroxgz,DefendingAIArt
Superseaslug,"It's both. 

In some places it's just censorship spurred on by people whining. There's several subs I know where AI was used just fine until a small group threw a fit to the mods and got it banned. 

HOWEVER

there are some places it makes complete sense to be banned. Pics is one, considering it focuses on actual photos. Animal related subs it should be heavily moderated. Don't want people posting pictures of AI birds in a birdwatching sub. There are places AI doesn't make sense, and people unfortunately cannot be trusted to lie for karma. ",Kasm001,"""AI art is now banned in many places on Reddit — is this an art massacre or necessary protection?""",oa1j48w,1rroxgz,1rroxgz,DefendingAIArt
sammoga123,"I would say that the term ""slop"" is also valid because many people just spend their time making low-quality things and uploading them, and the worst part is that many times there are a lot of images.

But just as there is AI ""slop,"" there is also human slop. The difference is that everything is reversed. It's more likely to see something ""generic"" made with AI (for example, the ""style"" that most people think is the only thing AI can do, plasticky characters) to something that doesn't even seem like AI from the start, or well, something that makes sense instead of a ""hey! I did advertising, hey! I did some random thing I asked ChatGPT"" thing",Superseaslug,"It's both. 

In some places it's just censorship spurred on by people whining. There's several subs I know where AI was used just fine until a small group threw a fit to the mods and got it banned. 

HOWEVER

there are some places it makes complete sense to be banned. Pics is one, considering it focuses on actual photos. Animal related subs it should be heavily moderated. Don't want people posting pictures of AI birds in a birdwatching sub. There are places AI doesn't make sense, and people unfortunately cannot be trusted to lie for karma. ",oa2wv9x,oa1j48w,1rroxgz,DefendingAIArt
Witty_Mycologist_995,Exactly.,Superseaslug,"It's both. 

In some places it's just censorship spurred on by people whining. There's several subs I know where AI was used just fine until a small group threw a fit to the mods and got it banned. 

HOWEVER

there are some places it makes complete sense to be banned. Pics is one, considering it focuses on actual photos. Animal related subs it should be heavily moderated. Don't want people posting pictures of AI birds in a birdwatching sub. There are places AI doesn't make sense, and people unfortunately cannot be trusted to lie for karma. ",oa1wzps,oa1j48w,1rroxgz,DefendingAIArt
ZeColorOfPomegranate,Just Reddit fascism nothing more nothing else...,Kasm001,"""AI art is now banned in many places on Reddit — is this an art massacre or necessary protection?""",oa13vz3,1rroxgz,1rroxgz,DefendingAIArt
Dew-Fox-6899,The bans don't mean much when people cant differentiate. Just stop disclosing how it was made.,Kasm001,"""AI art is now banned in many places on Reddit — is this an art massacre or necessary protection?""",oa11npu,1rroxgz,1rroxgz,DefendingAIArt
JTSG12,But...isn't that kinda a problem? I though the watermarks were required.,Dew-Fox-6899,The bans don't mean much when people cant differentiate. Just stop disclosing how it was made.,oa1lny3,oa11npu,1rroxgz,DefendingAIArt
Dew-Fox-6899,You can easily remove watermarks. There is no reliable way to detect it.,JTSG12,But...isn't that kinda a problem? I though the watermarks were required.,oa1nj62,oa1lny3,1rroxgz,DefendingAIArt
jfcarr,Perhaps a conspiracy to get pre-vetted data to sell to other companies as clean AI training data?,Kasm001,"""AI art is now banned in many places on Reddit — is this an art massacre or necessary protection?""",oa0zbc1,1rroxgz,1rroxgz,DefendingAIArt
rampant_cat,Yeah tbh,jfcarr,Perhaps a conspiracy to get pre-vetted data to sell to other companies as clean AI training data?,oa12uha,oa0zbc1,1rroxgz,DefendingAIArt
Timub,"When social media first came out, boomers reacted the exact same way. Over time they adapted. Feels like we’re just watching the same cycle again. Some people just haven’t reached that stage yet.",Kasm001,"""AI art is now banned in many places on Reddit — is this an art massacre or necessary protection?""",oa16sh8,1rroxgz,1rroxgz,DefendingAIArt
Zidan19283,"It's a censorship mainly driven by the reactionary liberal antiai ""movement""   
",Kasm001,"""AI art is now banned in many places on Reddit — is this an art massacre or necessary protection?""",oa0ymj5,1rroxgz,1rroxgz,DefendingAIArt
Bluetails_Buizel,"Yup, it’s the mods responding to the minority vocal. Not the mods themselves choose it.",Zidan19283,"It's a censorship mainly driven by the reactionary liberal antiai ""movement""   
",oa14cq1,oa0ymj5,1rroxgz,DefendingAIArt
CaptainTenilleTTV,Leave your politics out of the conversation,Zidan19283,"It's a censorship mainly driven by the reactionary liberal antiai ""movement""   
",oa18ym8,oa0ymj5,1rroxgz,DefendingAIArt
StrangeCrunchy1,Definit4ely artistic censorship,Kasm001,"""AI art is now banned in many places on Reddit — is this an art massacre or necessary protection?""",oa4ykw4,1rroxgz,1rroxgz,DefendingAIArt
BradleyM96,"None of this is ""Necessary"", This whole AI hate is completely artificial! Actual people in the real world do not care about if something was made with AI or not! A lot of people were happy that AI programs could be used to create Art... prior to people bitching about it!

The big reason people are making a big hissy fit about AI Art is because people made a big hissy fit out of it, one of the only reasons anyone is even questioning if AI can be Art is because of elitist artists who feel threatened by the idea of everyone being able to create for their self, instead of needing to deal with them. So they publicly condemned the Art form & shamed anyone who used it, saying it's ""not real art"" (even though before AI became big, most sane people would tell you that **Anything can be Art**).

& the more places there are out there that outlaw AI Art, the more places there will be to breed toxic anti-ai beliefs! The fact that anyone is even questioning if outlawing a form of Art is a good or bad thing just proves that the internet's artistic elite's shaming tactics are working! (I have nothing against you Kasm001 & I hope you're having a great month! I'm just upset with this corrupt system).

The point of my rant is, some people believe that in a couple years time, AI will be accepted as a mainstream Art form, So forbidding AI Art from being posted or adding weird rules that AI Art must follow (& only AI Art has to follow) well just lead to unnecessary artistic-discrimination in the online Art communities (& some artists already have to worry about being hated for things like posting furry or anime Art), or in an even worst case scenario, websites that bad AI Art would look dated in the eyes of mainstream society, & would be promptly avoided.

...Well um... Looks like I've went on a bit of a tangent...

So to sum up what I said quickly. 1, To me, The hate against AI is completely made up. 2, Banning AI Art on a website will just lead to it becoming a big anti-ai echo chamber. 3, If mainstream society accepts AI as an Art form, websites that ban AI Art will look dated & crusty in the eyes of mainstream society.

If anyone read this far, I hope you're having a great day! :)",Kasm001,"""AI art is now banned in many places on Reddit — is this an art massacre or necessary protection?""",oa2af0q,1rroxgz,1rroxgz,DefendingAIArt
SnooCats5204,"It depends on the context. If it's place for sharing artwork, it's understandable. If it's on place that have nothing to do with art and prohibit simple illustrations via AI, it's a problem.",Kasm001,"""AI art is now banned in many places on Reddit — is this an art massacre or necessary protection?""",oa159v9,1rroxgz,1rroxgz,DefendingAIArt
Deli-op,"The biggest bad thing about that to me is lets say its a sub of 10k people and they ban ai, ok ill make my own sub. Now i have an inferior empty sub with 3 people that no ones going to want to join cuz the other one still has like 8k people now and still plenty of engagement, just minus any ai which was only one or two posts a week before",Kasm001,"""AI art is now banned in many places on Reddit — is this an art massacre or necessary protection?""",oa19h6e,1rroxgz,1rroxgz,DefendingAIArt
charlie-westi,It is banned in most of the art subs other than the few ones which have ai in there sub name most of the time people downvote just in min of posting and then mods come to delete it and say blah blah ai is sht and shouldn't be posted in here or something like that ,Kasm001,"""AI art is now banned in many places on Reddit — is this an art massacre or necessary protection?""",oa1adma,1rroxgz,1rroxgz,DefendingAIArt
sammoga123,"That's why I have to ""lie in the white lie."" I try to do things that seem traditional and made without any possible trace of being AI.

If a generation messed up the character's coloring, a feature, or if it looks too ""melted"" after some edits, then I change the approach. In fact, I've done it twice already; yesterday was one of those times, and everyone praised me. Pixiv asks you to tag content with AI, but there's a switch that removes all that, so I've decided never to tag it. Yes, I know, I don't like to lie, but I also don't like that there's something to hide that and not something else, you know? 

I will never again label what I do with AI, whether I end up modifying it a lot or a little, or if the first result I got was good and didn't need any modification. I'm fed up with labels. I'm already fed up with people saying ""I respect you, but I want you out of my sight"" because of my sexuality, only for it to be repeated now, but with a filter that forces you to label things so those Luddites can't see them with the push of a button. If they really don't want to see AI, they'll have to use their brains to figure out if what I upload is or isn't AI, and then block me or do whatever they want. I'm not going to make it easy for them either.",Kasm001,"""AI art is now banned in many places on Reddit — is this an art massacre or necessary protection?""",oa2vpvt,1rroxgz,1rroxgz,DefendingAIArt
Superseaslug,"Slop is definitely a thing, but something is not slop purely because how it was made. I've made plenty of slop, I just don't post it because it's usually just part of the process. ",Kasm001,"""AI art is now banned in many places on Reddit — is this an art massacre or necessary protection?""",oa32j6s,1rroxgz,1rroxgz,DefendingAIArt
IronBloodForgeAI,Let them try to hold back the hands of time ,Kasm001,"""AI art is now banned in many places on Reddit — is this an art massacre or necessary protection?""",oa4o48a,1rroxgz,1rroxgz,DefendingAIArt
Kukamakachu,"""If all the peasants start dressing like us, then how will we be able to know who's a peasant and who's a noble‽""

-Some guy in 1700 France, probably.",Kasm001,"""AI art is now banned in many places on Reddit — is this an art massacre or necessary protection?""",oa6dovq,1rroxgz,1rroxgz,DefendingAIArt
AnalysisBudget,"If the sub is about pencil drawing then I get the point, if there is a flood of generated stuff then uh, I guess. But banning AI saying something is bad just because AI, thats just going too far. The anti gang are loud and annoying and wont shut the fuck up about it. I am so annoyed with them and anyone who listens to their fucking whining.",Kasm001,"""AI art is now banned in many places on Reddit — is this an art massacre or necessary protection?""",oa7ltzb,1rroxgz,1rroxgz,DefendingAIArt
Historical_Nail1882,Because AI has fallen in the hands in the wrong people,Kasm001,"""AI art is now banned in many places on Reddit — is this an art massacre or necessary protection?""",oa1c2j2,1rroxgz,1rroxgz,DefendingAIArt
dickdrainer99,"Im legitimately asking, can't you make a sub devoted to ai art? 

As long as you're allowed to make your own place, and allowed to remove people from it that you don't want like any other sub, I don't see the issue I guess. ",Kasm001,"""AI art is now banned in many places on Reddit — is this an art massacre or necessary protection?""",oa13iwz,1rroxgz,1rroxgz,DefendingAIArt
PeachyPlnk,"As far as I'm aware, yes, but it'll be constantly brigaded by antis and also filled with the kind of low quality generic ai art all the antis love to rag on. There are subs dedicated to ai art, though I can't remember any of them off the top of my head.

If nothing else, my wip website will be ai friendly, and I have a gate at the start that will ip block anyone who's anti, so it'll be a safe space to chill.",dickdrainer99,"Im legitimately asking, can't you make a sub devoted to ai art? 

As long as you're allowed to make your own place, and allowed to remove people from it that you don't want like any other sub, I don't see the issue I guess. ",oa14mn1,oa13iwz,1rroxgz,DefendingAIArt
dickdrainer99,"I don't pay enough attention to this topic, I'm mostly here because I enjoy the tool that ai is, and am bemused watching the anti ai people use the same rhetorical goofball tactics of wild hyperbole. 

Is really unfortunate that some people can't seem to understand that if they don't like something, they can not look at it. ",PeachyPlnk,"As far as I'm aware, yes, but it'll be constantly brigaded by antis and also filled with the kind of low quality generic ai art all the antis love to rag on. There are subs dedicated to ai art, though I can't remember any of them off the top of my head.

If nothing else, my wip website will be ai friendly, and I have a gate at the start that will ip block anyone who's anti, so it'll be a safe space to chill.",oa1s7mp,oa14mn1,1rroxgz,DefendingAIArt
No-Zookeepergame8837,"There are several, but almost all are flooded with antis, and the subreddits that allow AI but aren't focused on it are also flooded with antis spamming ""ban AI!"" or promoting themselves by offering content whose only appeal is ""I don't use AI for this"" and making a scene as soon as they get banned because ""Why don't they ban AI but they do ban me for spamming and/or insulting AI users!?""",dickdrainer99,"Im legitimately asking, can't you make a sub devoted to ai art? 

As long as you're allowed to make your own place, and allowed to remove people from it that you don't want like any other sub, I don't see the issue I guess. ",oa1h5g7,oa13iwz,1rroxgz,DefendingAIArt
dickdrainer99,"I just can't wrap my head around, and don't think I'll ever be able to wrap my head around this concept of looking for things to be outraged over. 

If you don't like ai, that's groovy man, don't use it. It's this never ending hyperbole being used that just staggers me. ""If you use ai, you're a planet killing Nazi!!!1!1."" 

If I am scrolling and see something I don't like, I keep scrolling. Apparently that makes me a bootlicker. ",No-Zookeepergame8837,"There are several, but almost all are flooded with antis, and the subreddits that allow AI but aren't focused on it are also flooded with antis spamming ""ban AI!"" or promoting themselves by offering content whose only appeal is ""I don't use AI for this"" and making a scene as soon as they get banned because ""Why don't they ban AI but they do ban me for spamming and/or insulting AI users!?""",oa1sqyz,oa1h5g7,1rroxgz,DefendingAIArt
Waldo-San,"To be completely honest, reddit is what it is because there's a community for everything. I don't think it's necessarily censorship for a sub, focused on traditionally made art, to not allow AI made art. Just like I don't think it's censorship for a sub focused on traditional art to not allow digital, and vice versa. ",Kasm001,"""AI art is now banned in many places on Reddit — is this an art massacre or necessary protection?""",oa16n7i,1rroxgz,1rroxgz,DefendingAIArt
A_Very_Horny_Zed,"You have a point (subreddits based around traditional art are not necessarily required to allow a new medium of art in its category) but I would argue that whether or not the moderators' decision to ban it is censorship depends on their motivations.

  
If a photography sub bans art made with AI, fair.

  
If a gaming sub bans art made with AI because a vocal and misinformed minority complains — not good. Censorship. Echo chambering.",Waldo-San,"To be completely honest, reddit is what it is because there's a community for everything. I don't think it's necessarily censorship for a sub, focused on traditionally made art, to not allow AI made art. Just like I don't think it's censorship for a sub focused on traditional art to not allow digital, and vice versa. ",oa19bd4,oa16n7i,1rroxgz,DefendingAIArt
Waldo-San,"Agreed. Thing is, most subreddits (especially those who aren't too big) have rules that reflect the mods opinions. Same way some subs flat out ban LGBT people, amongst other things, AI isn't the only problem.",A_Very_Horny_Zed,"You have a point (subreddits based around traditional art are not necessarily required to allow a new medium of art in its category) but I would argue that whether or not the moderators' decision to ban it is censorship depends on their motivations.

  
If a photography sub bans art made with AI, fair.

  
If a gaming sub bans art made with AI because a vocal and misinformed minority complains — not good. Censorship. Echo chambering.",oa1bv8l,oa19bd4,1rroxgz,DefendingAIArt
Herr_Drosselmeyer,"https://preview.redd.it/kqh49zmn5mog1.png?width=832&format=png&auto=webp&s=5f26b7baf46488f3d219acabc8ee6550a25dfa65

",Kasm001,"""AI art is now banned in many places on Reddit — is this an art massacre or necessary protection?""",oa17x0n,1rroxgz,1rroxgz,DefendingAIArt
ManicMudslide,"We could stop calling it art and just call them pictures. There are good ones and bad ones. I opened my facebook and instagram Apps for the first time in years and was appalled at how many awful AI generated pictures there were. They were awful not because they were AI, they were awful because the person that shared them had no concept of; balance, composition, framing, colour, symmetry, depth, consistency, relevance, or moderation and apparently had no inclination to curate them before showing them off to the world. People understandably get annoyed if shit is constantly being shoved in their face. Sadly, I have become more circumspect about mentioning my hobby to anyone.",Kasm001,"""AI art is now banned in many places on Reddit — is this an art massacre or necessary protection?""",oa1g6dt,1rroxgz,1rroxgz,DefendingAIArt
Immediate_Song4279,"I have to disagree. A subreddit is in essence not a public space, it is a private space that allows public access since it is not curated by reddit, but by users. That distinction holds.

Do I think they are being unreasonable, setting absurd metaphysical standards rather than focus on something like quality, or even better just being honest ""here is what we like and we don't like *that.*"" Yes, I do.

Even this space could decide my points of dissent outweigh my advocacy for the potential uses of AI, and give me the boot. But these are being poised as extremes, and I think the reality is messier.


Edit: downvotes aren't surprising, but can either of you tell me what it accomplishs?",Kasm001,"""AI art is now banned in many places on Reddit — is this an art massacre or necessary protection?""",oa1c2a3,1rroxgz,1rroxgz,DefendingAIArt
DeltaBot,"/u/HaxboyYT (OP) has awarded 1 delta(s) in this post.

All comments that earned deltas (from OP or other users) are listed [here](/r/DeltaLog/comments/1nynde3/deltas_awarded_in_cmv_generative_ai_should_be/), in /r/DeltaLog.

Please note that a change of view doesn't necessarily mean a reversal, or that the conversation has ended.

^[Delta System Explained](https://www.reddit.com/r/changemyview/wiki/deltasystem) ^| ^[Deltaboards](https://www.reddit.com/r/changemyview/wiki/deltaboards)",HaxboyYT,CMV: Generative AI Should be Banned,nhvsum8,1nym59o,1nym59o,changemyview
theosamabahama,">In an increasingly polarising world, where different sides cannot even agree on basic fact, the potential for political chaos caused by AI is too great.

People already lived in complete separate realities before AI. Nothing has changed.",HaxboyYT,CMV: Generative AI Should be Banned,nhvlv2u,1nym59o,1nym59o,changemyview
Candelestine,"There's degrees to things, and so long as people are alive, it is possible to get worse.

So, this is like saying that just because you survived a really hot summer day that one time, you should be perfectly fine in a 400 degree oven. I mean, how could anything be worse than that hot day that one time?",theosamabahama,">In an increasingly polarising world, where different sides cannot even agree on basic fact, the potential for political chaos caused by AI is too great.

People already lived in complete separate realities before AI. Nothing has changed.",nhvr9ct,nhvlv2u,1nym59o,changemyview
classyfapist,"Social media should probably be heavily regulated, too. The only problem is that no one can be trusted to do so.",theosamabahama,">In an increasingly polarising world, where different sides cannot even agree on basic fact, the potential for political chaos caused by AI is too great.

People already lived in complete separate realities before AI. Nothing has changed.",nika5cu,nhvlv2u,1nym59o,changemyview
HaxboyYT,I’d argue it’d become even worse,theosamabahama,">In an increasingly polarising world, where different sides cannot even agree on basic fact, the potential for political chaos caused by AI is too great.

People already lived in complete separate realities before AI. Nothing has changed.",nhvorx7,nhvlv2u,1nym59o,changemyview
