src_user,src_comment,dst_user,dst_comment,comment_id,parent_id,submission_id,subreddit
Feroc,"> I'm well aware that calculators exist. However, I never once used one in school because I was told it was cheating and that it would have consequences. 

Then you must be very very old. Nowadays it's a normal thing to use and you can learn things with calculates that you couldn't do without.

> Using GenAI doesn't and never makes you an artist. How you can be truly an artist if you wanna become one is that you practice. Draw what comes to your heart, and use a pencil or stylus. No matter if it's digital or traditional. You can be an artist without advocating to have artists eradicated metaphorically. 

""Artist"" is just an arbitrary label, it's not dependent on the tools that are used. What you are talking about is an illustrator, a sketcher, a painter, etc.. Those are skills you can learn, but they are not required to create art.

> As in have artists from all professions replaced, artists fired and have artists work being exploited just to help the rich. If anything, Gen AI is supposed to be anti-corporate. But apparently, it's helping the rich more by stealing our works and claiming all ownership. 

Hopefully they can find all those stolen images. 

> You people can abolish human creativity and replace artists. Hell, you can kill all human artists if you had to. But we'll never automate the process of creating things just because most of you are too lazy to draw and create things the more genuine way and fulfilling way.

No one is going to. I am happy for everyone who has a hobby they can enjoy or a profession they love.

> If I had the power and the funds, I'd ban all Gen AI and forbid them from being used in art schools and keep it out of our schools. 

Then it's good that you don't have the power and the funds, you would hinder further advancements.

> You're already an artist if you have experience. But if you're gonna use Gen AI to abolish human creativity and take away artists' future jobs in the industry, then you aren't really an artist. And that's the truth...

Future artists in the industry will use AI to their advantage. Just like software developers already use AI to their advantage... or any other profession uses tools that makes their work easier.",Videogame-repairguy,"I'm well aware that calculators exist. However, I never once used one in school because I was told it was cheating and that it would have consequences. 

Using GenAI doesn't and never makes you an artist. How you can be truly an artist if you wanna become one is that you practice. Draw what comes to your heart, and use a pencil or stylus. No matter if it's digital or traditional. You can be an artist without advocating to have artists eradicated metaphorically. 

As in have artists from all professions replaced, artists fired and have artists work being exploited just to help the rich. If anything, Gen AI is supposed to be anti-corporate. But apparently, it's helping the rich more by stealing our works and claiming all ownership. 

What I create doesn't belong to anybody, even if a redditor tells me I'm useless just because I'm an artist who doesn't use Gen AI.

I have something most redditors don't have.

I have talent that took me years to perfect. It was hard, but it was worth the hard work and effort. 

I have an artist honesty, I don't plan on exploiting other people's work by stealing and claiming their work for my own. Even if I do draw people's characters all the time. That doesn't mean I own the rights.

You people can abolish human creativity and replace artists. Hell, you can kill all human artists if you had to. But we'll never automate the process of creating things just because most of you are too lazy to draw and create things the more genuine way and fulfilling way.

If I had the power and the funds, I'd ban all Gen AI and forbid them from being used in art schools and keep it out of our schools. 

Because pretending you're an artist by using a machine that helps you cheat at art and a machine that helps you steal more artwork from hard-working artists who are genuine more artist then a entire subreddit full of people who somehow defend the rich more then they fight it. 

You're already an artist if you have experience. But if you're gonna use Gen AI to abolish human creativity and take away artists' future jobs in the industry, then you aren't really an artist. And that's the truth...",kzgrmco,kzgocju,1c09qj3,aiwars
Videogame-repairguy,"> Then you must be very, very old. Nowadays it's a normal thing to use and you can learn things with calculates that you couldn't do without.

So, being in my mid-20s is considered old? Alright. I see your logic.

> ""Artist"" is just an arbitrary label. It's not dependent on the tools that are used. What you are talking about is an illustrator, a sketcher, a painter, etc.. Those are skills you can learn, but they are not required to create art.

> Hopefully, they can find all those stolen images. 

Mocking artists won't work with gaining support for Gen AI. Artists online aren't just people you can steal from and exploit. Something that Pro-AI often encourages.

""Go online, steal anyone's artwork, and they won't sue you. It's hunting season.""

> No one is going to. I am happy for everyone who has a hobby they can enjoy or a profession they love.

It doesn't seem like it since most of this reddit is up for the idea of replacing professional artists. And exploiting artists' hard work by stealing and claiming artists' work.

> Then it's good that you don't have the power and the funds. You would hinder further advancements.

Pro-AI hinders artists' chances at joining the industry itself, so it's sad how regular artists like me won't be allowed to work in the industry since AI can quote on quote. ""Do a much better job than real human artists."" 

> Future artists in the industry will use AI to their advantage. Just like software developers already use AI to their advantage... or any other profession uses tools that make their work easier.

Or make cheating easier.",Feroc,"> I'm well aware that calculators exist. However, I never once used one in school because I was told it was cheating and that it would have consequences. 

Then you must be very very old. Nowadays it's a normal thing to use and you can learn things with calculates that you couldn't do without.

> Using GenAI doesn't and never makes you an artist. How you can be truly an artist if you wanna become one is that you practice. Draw what comes to your heart, and use a pencil or stylus. No matter if it's digital or traditional. You can be an artist without advocating to have artists eradicated metaphorically. 

""Artist"" is just an arbitrary label, it's not dependent on the tools that are used. What you are talking about is an illustrator, a sketcher, a painter, etc.. Those are skills you can learn, but they are not required to create art.

> As in have artists from all professions replaced, artists fired and have artists work being exploited just to help the rich. If anything, Gen AI is supposed to be anti-corporate. But apparently, it's helping the rich more by stealing our works and claiming all ownership. 

Hopefully they can find all those stolen images. 

> You people can abolish human creativity and replace artists. Hell, you can kill all human artists if you had to. But we'll never automate the process of creating things just because most of you are too lazy to draw and create things the more genuine way and fulfilling way.

No one is going to. I am happy for everyone who has a hobby they can enjoy or a profession they love.

> If I had the power and the funds, I'd ban all Gen AI and forbid them from being used in art schools and keep it out of our schools. 

Then it's good that you don't have the power and the funds, you would hinder further advancements.

> You're already an artist if you have experience. But if you're gonna use Gen AI to abolish human creativity and take away artists' future jobs in the industry, then you aren't really an artist. And that's the truth...

Future artists in the industry will use AI to their advantage. Just like software developers already use AI to their advantage... or any other profession uses tools that makes their work easier.",kzgwpxc,kzgrmco,1c09qj3,aiwars
Feroc,"> So, being in my mid-20s is considered old? Alright. I see your logic.

What kind of school did you visit that you didn't learn how to use a calculator? I am about 20 years older than you and a calculator was a basic tool in middle school (or at least the German version of it).

> Mocking artists won't work with gaining support for Gen AI. Artists online aren't just people you can steal from and exploit. Something that Pro-AI often encourages.

Again: How many images were stolen? Are they gone now? Could they find some of the images at the thieves place?

> It doesn't seem like it since most of this reddit is up for the idea of replacing professional artists. And exploiting artists' hard work by stealing and claiming artists' work.

How many artists did get replaced? Do you have statistics on that?

> Pro-AI hinders artists' chances at joining the industry itself, so it's sad how regular artists like me won't be allowed to work in the industry since AI can quote on quote. ""Do a much better job than real human artists."" 

Pro-cars hinders horse breeders chances at joining the industry itself. If a job is not needed anymore, then why should people still hire people for it? If there is no demand, then there is no job. Though someone still has to tell the AI what to do, has to edit the images, has to think about a layout, etc. 

> Or make cheating easier.

Using proper tools for your profession isn't cheating. That's like saying that the carpenter is cheating because he is using power tools. If you want to be successful then you have to be agile. You have to be able to adjust to new technologies and learn new stuff. No one needs people with a ""we always did it that way"" attitude.",Videogame-repairguy,"> Then you must be very, very old. Nowadays it's a normal thing to use and you can learn things with calculates that you couldn't do without.

So, being in my mid-20s is considered old? Alright. I see your logic.

> ""Artist"" is just an arbitrary label. It's not dependent on the tools that are used. What you are talking about is an illustrator, a sketcher, a painter, etc.. Those are skills you can learn, but they are not required to create art.

> Hopefully, they can find all those stolen images. 

Mocking artists won't work with gaining support for Gen AI. Artists online aren't just people you can steal from and exploit. Something that Pro-AI often encourages.

""Go online, steal anyone's artwork, and they won't sue you. It's hunting season.""

> No one is going to. I am happy for everyone who has a hobby they can enjoy or a profession they love.

It doesn't seem like it since most of this reddit is up for the idea of replacing professional artists. And exploiting artists' hard work by stealing and claiming artists' work.

> Then it's good that you don't have the power and the funds. You would hinder further advancements.

Pro-AI hinders artists' chances at joining the industry itself, so it's sad how regular artists like me won't be allowed to work in the industry since AI can quote on quote. ""Do a much better job than real human artists."" 

> Future artists in the industry will use AI to their advantage. Just like software developers already use AI to their advantage... or any other profession uses tools that make their work easier.

Or make cheating easier.",kzgy3hf,kzgwpxc,1c09qj3,aiwars
Videogame-repairguy,"> What kind of school did you visit that you didn't learn how to use a calculator? I am about 20 years older than you, and a calculator was a basic tool in middle school (or at least the German version of it).

Bud, every time I try and use a calculator. I'd immediately be written up and sent to the office. It's a good thing you got *privilege* then, huh?.

>Again: How many images were stolen? Are they gone now? Could they find some of the images at the thieves' place?

There it goes again, intentionally missing the point, and the mocking continues. 

>How many artists did you get replaced? Do you have statistics on that?

There it goes again. Artists are being replaced left and right. I know what's going to happen. I'm gonna say I have no statistics, and you'll continuously downplay my concerns like all Pro-AI does. 

>Pro-cars hinder horse breeders' chances of joining the industry itself. If a job is not needed anymore, then why should people still hire people for it? If there is no demand, then there is no job. Though someone still has to tell the AI what to do, has to edit the images, has to think about a layout, etc. 

# No. We're not giving all artists jobs up to AI. We're not gonna let that happen. Neither will I.

>Using proper tools for your profession isn't cheating. That's like saying that the carpenter is cheating because he is using power tools. If you want to be successful, then you have to be agile. You have to be able to adjust to new technologies and learn new stuff. No one needs people with a ""we always did it that way"" attitude.

I'm not gonna automate my process. Thank you, I love learning and growing my skills the way I've always been familiar with and not cheating with tools that make creating art more lazy. I'm not lazy, I'm not gonna be called lazy like you people are seen as.

I don't need to adapt. I'm not going to adapt, why? Because I don't agree with making the process more ""Easy."" When the actual term is just making the process more lazily achievable.",Feroc,"> So, being in my mid-20s is considered old? Alright. I see your logic.

What kind of school did you visit that you didn't learn how to use a calculator? I am about 20 years older than you and a calculator was a basic tool in middle school (or at least the German version of it).

> Mocking artists won't work with gaining support for Gen AI. Artists online aren't just people you can steal from and exploit. Something that Pro-AI often encourages.

Again: How many images were stolen? Are they gone now? Could they find some of the images at the thieves place?

> It doesn't seem like it since most of this reddit is up for the idea of replacing professional artists. And exploiting artists' hard work by stealing and claiming artists' work.

How many artists did get replaced? Do you have statistics on that?

> Pro-AI hinders artists' chances at joining the industry itself, so it's sad how regular artists like me won't be allowed to work in the industry since AI can quote on quote. ""Do a much better job than real human artists."" 

Pro-cars hinders horse breeders chances at joining the industry itself. If a job is not needed anymore, then why should people still hire people for it? If there is no demand, then there is no job. Though someone still has to tell the AI what to do, has to edit the images, has to think about a layout, etc. 

> Or make cheating easier.

Using proper tools for your profession isn't cheating. That's like saying that the carpenter is cheating because he is using power tools. If you want to be successful then you have to be agile. You have to be able to adjust to new technologies and learn new stuff. No one needs people with a ""we always did it that way"" attitude.",kzxuyon,kzgy3hf,1c09qj3,aiwars
Feroc,"> Bud, every time I try and use a calculator. I'd immediately be written up and sent to the office. It's a good thing you got privilege then, huh?.

Having a school system that teaches the current state of the world is a privilege? I mean sure it is, but no one should be proud that they don't have that privilege. 

> There it goes again, intentionally missing the point, and the mocking continues. 

Maybe you should express yourself better and not use the wrong expressions.

> There it goes again. Artists are being replaced left and right. I know what's going to happen. I'm gonna say I have no statistics, and you'll continuously downplay my concerns like all Pro-AI does. 

Yes, if you have accusations, then you should be able to back them up with figures.

> I'm not gonna automate my process. Thank you, I love learning and growing my skills the way I've always been familiar with and not cheating with tools that make creating art more lazy. I'm not lazy, I'm not gonna be called lazy like you people are seen as.

> I don't need to adapt. I'm not going to adapt, why? Because I don't agree with making the process more ""Easy."" When the actual term is just making the process more lazily achievable.

An employee who deliberately uses inferior tools and thus costs more money than he should is simply not sustainable in the long term.",Videogame-repairguy,"> What kind of school did you visit that you didn't learn how to use a calculator? I am about 20 years older than you, and a calculator was a basic tool in middle school (or at least the German version of it).

Bud, every time I try and use a calculator. I'd immediately be written up and sent to the office. It's a good thing you got *privilege* then, huh?.

>Again: How many images were stolen? Are they gone now? Could they find some of the images at the thieves' place?

There it goes again, intentionally missing the point, and the mocking continues. 

>How many artists did you get replaced? Do you have statistics on that?

There it goes again. Artists are being replaced left and right. I know what's going to happen. I'm gonna say I have no statistics, and you'll continuously downplay my concerns like all Pro-AI does. 

>Pro-cars hinder horse breeders' chances of joining the industry itself. If a job is not needed anymore, then why should people still hire people for it? If there is no demand, then there is no job. Though someone still has to tell the AI what to do, has to edit the images, has to think about a layout, etc. 

# No. We're not giving all artists jobs up to AI. We're not gonna let that happen. Neither will I.

>Using proper tools for your profession isn't cheating. That's like saying that the carpenter is cheating because he is using power tools. If you want to be successful, then you have to be agile. You have to be able to adjust to new technologies and learn new stuff. No one needs people with a ""we always did it that way"" attitude.

I'm not gonna automate my process. Thank you, I love learning and growing my skills the way I've always been familiar with and not cheating with tools that make creating art more lazy. I'm not lazy, I'm not gonna be called lazy like you people are seen as.

I don't need to adapt. I'm not going to adapt, why? Because I don't agree with making the process more ""Easy."" When the actual term is just making the process more lazily achievable.",kzycbbp,kzxuyon,1c09qj3,aiwars
Videogame-repairguy,">Maybe you should express yourself better and not use the wrong expressions.

Using traditional and digital art as of means isn't improperly expressing myself, just because I'm not using Gen AI.

>Yes, if you have accusations, then you should be able to back them up with figures.

Wanna know something? I'm not gonna spoonfeed any information because the internet exists.

>An employee who deliberately uses inferior tools and thus costs more money than he should is simply not sustainable in the long term.

Don't try and make me fear. I'm not interested.",Feroc,"> Bud, every time I try and use a calculator. I'd immediately be written up and sent to the office. It's a good thing you got privilege then, huh?.

Having a school system that teaches the current state of the world is a privilege? I mean sure it is, but no one should be proud that they don't have that privilege. 

> There it goes again, intentionally missing the point, and the mocking continues. 

Maybe you should express yourself better and not use the wrong expressions.

> There it goes again. Artists are being replaced left and right. I know what's going to happen. I'm gonna say I have no statistics, and you'll continuously downplay my concerns like all Pro-AI does. 

Yes, if you have accusations, then you should be able to back them up with figures.

> I'm not gonna automate my process. Thank you, I love learning and growing my skills the way I've always been familiar with and not cheating with tools that make creating art more lazy. I'm not lazy, I'm not gonna be called lazy like you people are seen as.

> I don't need to adapt. I'm not going to adapt, why? Because I don't agree with making the process more ""Easy."" When the actual term is just making the process more lazily achievable.

An employee who deliberately uses inferior tools and thus costs more money than he should is simply not sustainable in the long term.",kzyg7r9,kzycbbp,1c09qj3,aiwars
BuccalFatApologist,"I mean, you don’t have to think that “AI is theft” to believe that AI-generated pieces shouldn’t be judged in competition alongside human-drawn pieces. Just like you probably wouldn’t endorse using a rifle in an archery competition (or a photograph in a painting competition).

The technology is new enough that people are still figuring out where the lines are. Expect to see more of this sort of thing in the short term.",Videogame-repairguy,Ban AI generated images and AI generators from our schools and art schools.,kyva5n4,1c09qj3,1c09qj3,aiwars
Videogame-repairguy,Billionaires will most likely pay judges and whatnot to make AI win more art contests.,BuccalFatApologist,"I mean, you don’t have to think that “AI is theft” to believe that AI-generated pieces shouldn’t be judged in competition alongside human-drawn pieces. Just like you probably wouldn’t endorse using a rifle in an archery competition (or a photograph in a painting competition).

The technology is new enough that people are still figuring out where the lines are. Expect to see more of this sort of thing in the short term.",kzybb2s,kyva5n4,1c09qj3,aiwars
BuccalFatApologist,"Uh, why though? Billionaires already have the power to rig art competitions if they really want to. Doesn’t seem to happen that much.",Videogame-repairguy,Billionaires will most likely pay judges and whatnot to make AI win more art contests.,kzycccv,kzybb2s,1c09qj3,aiwars
Videogame-repairguy,They already have with AI.,BuccalFatApologist,"Uh, why though? Billionaires already have the power to rig art competitions if they really want to. Doesn’t seem to happen that much.",kzyg9bl,kzycccv,1c09qj3,aiwars
bbt104,"If &#10;

>  What we create and what we draw doesn't belong to anybody. &#10;

Then how can it be stealing if it doesn't belong to anybody?",Videogame-repairguy,"Schools and art schools shouldn't be normalizing tools that are linked to cheating and theft. Schools shouldn't be catering to billionaires who funded Generative AI just to own art and profit off stolen materials and artwork made from REAL artists.

What we create and what we draw doesn't belong to anybody. So I don't understand how hard it is to respect artists and to just not steal from them. It's only okay when Pro-AI steals apparently.",kyv7g1a,kyv2iuu,1c09qj3,aiwars
Videogame-repairguy,What we create and what we draw doesn't belong to anyone besides the artist. Thank you for correcting me.,bbt104,"If &#10;

>  What we create and what we draw doesn't belong to anybody. &#10;

Then how can it be stealing if it doesn't belong to anybody?",kzyalwc,kyv7g1a,1c09qj3,aiwars
SlightOfHand_,"Schools shouldn’t be normalizing tools that are linked to cheating and theft, such as personal computers. The ability to “copy” and “paste” other people’s work should not be tolerated when children should be doing these tasks themselves. Schools shouldn’t be catering to billionaires who own computer companies.",Videogame-repairguy,"Schools and art schools shouldn't be normalizing tools that are linked to cheating and theft. Schools shouldn't be catering to billionaires who funded Generative AI just to own art and profit off stolen materials and artwork made from REAL artists.

What we create and what we draw doesn't belong to anybody. So I don't understand how hard it is to respect artists and to just not steal from them. It's only okay when Pro-AI steals apparently.",kyv7qkv,kyv2iuu,1c09qj3,aiwars
Videogame-repairguy,Mocking concerns seem to work on pro-Ai's part.,SlightOfHand_,"Schools shouldn’t be normalizing tools that are linked to cheating and theft, such as personal computers. The ability to “copy” and “paste” other people’s work should not be tolerated when children should be doing these tasks themselves. Schools shouldn’t be catering to billionaires who own computer companies.",kzyap8o,kyv7qkv,1c09qj3,aiwars
Sheepolution,"I think almost everyone who agrees with you that it's theft would also agree that it shouldn't be in schools. But there are many people who don't think it is theft (and it has yet to be ruled otherwise). So there's not really a point in making this statement. Instead, you should try focussing on other arguments. Like how AI might make people lazy, less educated or less creative.",Videogame-repairguy,"Schools and art schools shouldn't be normalizing tools that are linked to cheating and theft. Schools shouldn't be catering to billionaires who funded Generative AI just to own art and profit off stolen materials and artwork made from REAL artists.

What we create and what we draw doesn't belong to anybody. So I don't understand how hard it is to respect artists and to just not steal from them. It's only okay when Pro-AI steals apparently.",kyv7dey,kyv2iuu,1c09qj3,aiwars
